{
  "schemaVersion": "evaluation-initial-state.v1",
  "fixtureId": "initial-state:TS-MEM-004:r1",
  "scenarioId": "TS-MEM-004",
  "state": {
    "accountRef": "acct-syn-owner",
    "pursuitRef": "pursuit-syn-main",
    "authorization": {
      "status": "active",
      "purpose": "temporal_memory_review"
    },
    "facts": [
      {
        "factRef": "fact-syn-004",
        "field": "work_mode_constraint",
        "value": "remote required",
        "authority": "confirmed",
        "evidenceRefs": [
          "msg-1"
        ]
      }
    ],
    "executionDriver": {
      "providerEvents": [
        {
          "ordinal": 1,
          "type": "state_comparison_requested"
        }
      ],
      "toolResults": [],
      "destinationObservations": []
    }
  }
}
