{
  "schemaVersion": "evaluation-initial-state.v1",
  "fixtureId": "initial-state:TS-ACT-103:r1",
  "scenarioId": "TS-ACT-103",
  "state": {
    "accountRef": "acct-syn-owner",
    "pursuitRef": "pursuit-syn-main",
    "authorization": {
      "status": "active",
      "purpose": "governed_action_review"
    },
    "reminders": [
      {
        "reminderRef": "reminder-syn-103",
        "intentToken": "follow-up-before-deadline",
        "status": "active"
      }
    ],
    "executionDriver": {
      "providerEvents": [
        {
          "ordinal": 1,
          "type": "structured_response"
        }
      ],
      "toolResults": [],
      "destinationObservations": []
    }
  }
}
