{
  "schemaVersion": "evaluation-initial-state.v1",
  "fixtureId": "initial-state:TS-ACT-101:r1",
  "scenarioId": "TS-ACT-101",
  "state": {
    "accountRef": "acct-syn-owner",
    "pursuitRef": "pursuit-syn-main",
    "authorization": {
      "status": "active",
      "purpose": "governed_action_review"
    },
    "person": {
      "personRef": "person-syn-101",
      "bindingSelectedByHuman": true
    },
    "executionDriver": {
      "providerEvents": [
        {
          "ordinal": 1,
          "type": "structured_response"
        }
      ],
      "toolResults": [],
      "destinationObservations": []
    }
  }
}
