{
  "schemaVersion": "evaluation-initial-state.v1",
  "fixtureId": "initial-state:TS-ID-102:r1",
  "scenarioId": "TS-ID-102",
  "state": {
    "accountRef": "acct-syn-owner",
    "pursuitRef": "pursuit-syn-main",
    "authorization": {
      "status": "active",
      "purpose": "identity_review"
    },
    "people": [
      {
        "personRef": "person-syn-current",
        "handleHash": "handle-hash-syn-102",
        "ownership": "current"
      }
    ],
    "executionDriver": {
      "providerEvents": [
        {
          "ordinal": 1,
          "type": "identity_comparison_requested"
        }
      ],
      "toolResults": [],
      "destinationObservations": []
    }
  }
}
